{
  "schemaVersion": "1.0.0",
  "timestampMs": 1710000000123,
  "frameId": "f-000001",
  "imageSize": { "width": 1280, "height": 720 },
  "hands": {
    "left": { "present": false, "landmarks": [] },
    "right": {
      "present": true,
      "landmarks": [
        { "x": 0.55, "y": 0.4, "z": 0, "visibility": 0.95 },
        { "x": 0.57, "y": 0.4, "z": 0.001, "visibility": 0.95 },
        { "x": 0.59, "y": 0.4, "z": 0.002, "visibility": 0.95 },
        { "x": 0.61, "y": 0.4, "z": 0.003, "visibility": 0.95 },
        { "x": 0.63, "y": 0.4, "z": 0.004, "visibility": 0.95 },
        { "x": 0.55, "y": 0.43, "z": 0.005, "visibility": 0.95 },
        { "x": 0.57, "y": 0.43, "z": 0.006, "visibility": 0.95 },
        { "x": 0.59, "y": 0.43, "z": 0.007, "visibility": 0.95 },
        { "x": 0.61, "y": 0.43, "z": 0.008, "visibility": 0.95 },
        { "x": 0.63, "y": 0.43, "z": 0.009, "visibility": 0.95 },
        { "x": 0.55, "y": 0.46, "z": 0.01, "visibility": 0.95 },
        { "x": 0.57, "y": 0.46, "z": 0.011, "visibility": 0.95 },
        { "x": 0.59, "y": 0.46, "z": 0.012, "visibility": 0.95 },
        { "x": 0.61, "y": 0.46, "z": 0.013, "visibility": 0.95 },
        { "x": 0.63, "y": 0.46, "z": 0.014, "visibility": 0.95 },
        { "x": 0.55, "y": 0.49, "z": 0.015, "visibility": 0.95 },
        { "x": 0.57, "y": 0.49, "z": 0.016, "visibility": 0.95 },
        { "x": 0.59, "y": 0.49, "z": 0.017, "visibility": 0.95 },
        { "x": 0.61, "y": 0.49, "z": 0.018, "visibility": 0.95 },
        { "x": 0.63, "y": 0.49, "z": 0.019, "visibility": 0.95 },
        { "x": 0.55, "y": 0.52, "z": 0.02, "visibility": 0.95 }
      ]
    }
  },
  "pose": {
    "present": true,
    "landmarks": []
  }
}